<?xml version="1.0" encoding="UTF-8"?>
<!--
*************************************************************
This file is used to define various types of EKP components,
including transactions and reports.

$Revision: 1.9 $
*************************************************************
-->
<components xmlns="http://www.netdimensions.com/xml/ns/components"
            xmlns:xsi="http://www.w3.org/2001/XMLSchema-instance"
            xsi:schemaLocation="http://www.netdimensions.com/xml/ns/components components.xsd">

	<transactions>
		<transaction>
			<tx-code>LDSHOME</tx-code>
			<tx-type>HOMEPAGE</tx-type>
			<feature>MyHome</feature>
			<access-level>ReadAccess</access-level>
			<class>com.netdimen.custom.lds.tx.LdsHome</class>
			<requires-authentication>true</requires-authentication>
			<nonblocking-transaction>true</nonblocking-transaction>
		</transaction>
		<transaction>
			<tx-code>LEARNINGSPACE</tx-code>
			<feature>KnowledgeCenter</feature>
			<access-level>ReadAccess</access-level>
			<class>com.netdimen.custom.lds.tx.LdsLearningSpace</class>
			<requires-authentication>true</requires-authentication>
			<nonblocking-transaction>true</nonblocking-transaction>
		</transaction>
		<transaction>
			<tx-code>CATFRAMES</tx-code>
			<feature>Catalog</feature>
			<access-level>ReadAccess</access-level>
			<class>com.netdimen.custom.lds.tx.LdsCatFrames</class>
			<requires-authentication>true</requires-authentication>
		</transaction>
		<transaction>
			<tx-code>LDSCAT_TOP</tx-code>
			<feature>Catalog</feature>
			<access-level>ReadAccess</access-level>
			<class>com.netdimen.custom.lds.tx.LdsCatTop</class>
			<requires-authentication>true</requires-authentication>
			<nonblocking-transaction>true</nonblocking-transaction>
		</transaction>
		<transaction>
			<tx-code>LDSCATINTRO</tx-code>
			<feature>Catalog</feature>
			<access-level>ReadAccess</access-level>
			<class>com.netdimen.custom.lds.tx.LdsCatIntro</class>
			<requires-authentication>true</requires-authentication>
			<nonblocking-transaction>true</nonblocking-transaction>
		</transaction>
		<transaction>
			<tx-code>LDSCAT_LEFT</tx-code>
			<feature>Catalog</feature>
			<access-level>ReadAccess</access-level>
			<class>com.netdimen.custom.lds.tx.LdsCatLeft</class>
			<requires-authentication>true</requires-authentication>
			<nonblocking-transaction>true</nonblocking-transaction>
		</transaction>
		<transaction>
			<tx-code>LDSSEARCHRESULT</tx-code>
			<feature>Catalog</feature>
			<access-level>ReadAccess</access-level>
			<class>com.netdimen.custom.lds.tx.LdsSearchResult</class>
			<requires-authentication>true</requires-authentication>
			<nonblocking-transaction>true</nonblocking-transaction>
		</transaction>
		<transaction>
			<tx-code>LDSSEARCHRESULT2</tx-code>
			<feature>Catalog</feature>
			<access-level>ReadAccess</access-level>
			<class>com.netdimen.custom.lds.tx.LdsSearchResult2</class>
			<requires-authentication>true</requires-authentication>
			<nonblocking-transaction>true</nonblocking-transaction>
		</transaction>
		<transaction>
			<tx-code>LDSSEARCHCAT</tx-code>
			<feature>Catalog</feature>
			<access-level>ReadAccess</access-level>
			<class>com.netdimen.custom.lds.tx.LdsSearchCAT</class>
			<requires-authentication>true</requires-authentication>
			<nonblocking-transaction>true</nonblocking-transaction>
		</transaction>
		<transaction>
			<tx-code>LDSTopMenu</tx-code>
			<tx-type>MENU</tx-type>
			<feature>System</feature>
			<access-level>ReadAccess</access-level>
			<class>com.netdimen.custom.lds.tx.LDSTopMenu</class>
			<requires-authentication>false</requires-authentication>
			<nonblocking-transaction>true</nonblocking-transaction>
		</transaction>
		<transaction>
			<tx-code>LDSCESSELFREGISTER</tx-code>
			<feature>System</feature>
			<access-level>ReadAccess</access-level>
			<class>com.netdimen.custom.lds.tx.LdsCesSelfRegister</class>
			<requires-authentication>false</requires-authentication>
		</transaction>
		<transaction>
			<tx-code>LDSCESSAVESELFREG</tx-code>
			<feature>System</feature>
			<access-level>ReadAccess</access-level>
			<class>com.netdimen.custom.lds.tx.LdsCesSaveSelfRegister</class>
			<requires-authentication>false</requires-authentication>
		</transaction>
		<transaction>
			<tx-code>LDSFCHSSO</tx-code>
			<feature>System</feature>
			<access-level>ReadAccess</access-level>
			<class>com.netdimen.tx.auth.HttpSso</class>
			<requires-authentication>false</requires-authentication>
		</transaction>
		<transaction>
			<tx-code>MIGRATEUSERPROMPT</tx-code>
			<feature>System</feature>
			<access-level>ReadAccess</access-level>
			<class>com.netdimen.custom.lds.tx.MigrateUserPrompt</class>
			<requires-authentication>false</requires-authentication>
		</transaction>
		<transaction>
			<tx-code>LDSHOMEMODULEANDNEWS</tx-code>
			<tx-type>HOMEPAGE</tx-type>
			<feature>MyHome</feature>
			<access-level>ReadAccess</access-level>
			<class>com.netdimen.custom.lds.tx.LdsHomeModuleAndNews</class>
			<requires-authentication>true</requires-authentication>
			<nonblocking-transaction>true</nonblocking-transaction>
		</transaction>
		<transaction>
			<tx-code>LDSSTANDARDTOPTABS</tx-code>
			<tx-type>MENU</tx-type>
			<feature>System</feature>
			<access-level>ReadAccess</access-level>
			<class>com.netdimen.tx.screen.StandardTopTabs</class>
			<requires-authentication>false</requires-authentication>
			<nonblocking-transaction>true</nonblocking-transaction>
		</transaction>
		<transaction>
			<tx-code>LDSFOOTER</tx-code>
			<tx-type>MENU</tx-type>
			<feature>System</feature>
			<access-level>ReadAccess</access-level>
			<class>com.netdimen.custom.lds.tx.screen.LdsFooter</class>
			<requires-authentication>true</requires-authentication>
		</transaction>
		<transaction>
			<tx-code>FORMAT1</tx-code>
			<tx-type>CATALOGFORMAT</tx-type>
			<feature>Catalog</feature>
			<access-level>ReadAccess</access-level>
			<class>com.netdimen.tx.catalogviewer.Format1</class>
			<requires-authentication>true</requires-authentication>
			<nonblocking-transaction>true</nonblocking-transaction>
		</transaction>
	</transactions>
</components>
